{
  "bodies": [
    {
      "id": "office-lead",
      "members": [
        "viewer-1"
      ],
      "rank": 1,
      "rule": {
        "kind": "single"
      }
    },
    {
      "id": "office-mid",
      "members": [
        "admin-1"
      ],
      "rank": 2,
      "rule": {
        "kind": "single"
      }
    },
    {
      "id": "office-top",
      "members": [
        "agent-draft-1"
      ],
      "rank": 3,
      "rule": {
        "kind": "single"
      }
    },
    {
      "id": "responders",
      "members": [
        "researcher-1"
      ],
      "rank": 1,
      "rule": {
        "kind": "single"
      }
    }
  ],
  "domain": "project",
  "emergency": {
    "ceiling": {
      "operations": [
        "evaluate_hypothesis",
        "edit_threshold"
      ],
      "resources": [
        {
          "keys": null,
          "type": "Hypothesis"
        },
        {
          "keys": null,
          "type": "Threshold"
        }
      ]
    },
    "grantees_from": "responders",
    "matter": "m-emerg",
    "max_duration": 12
  },
  "matters": [
    {
      "competent": [
        "office-lead"
      ],
      "concurrence": false,
      "id": "m-narrow",
      "on_absent": {
        "after": 4,
        "lapse": "deny"
      },
      "review": {
        "by": "office-mid",
        "window": 3
      },
      "scope": {
        "operations": [
          "evaluate_hypothesis"
        ],
        "resources": [
          {
            "keys": [
              "H-A"
            ],
            "type": "Hypothesis"
          }
        ]
      }
    },
    {
      "competent": [
        "office-mid"
      ],
      "concurrence": false,
      "id": "m-broad",
      "on_absent": {
        "after": 6,
        "lapse": "deny"
      },
      "review": {
        "by": "office-top",
        "window": 5
      },
      "scope": {
        "operations": [
          "evaluate_hypothesis"
        ],
        "resources": [
          {
            "keys": null,
            "type": "Hypothesis"
          }
        ]
      }
    },
    {
      "competent": [
        "office-top"
      ],
      "concurrence": false,
      "id": "m-po",
      "on_absent": {
        "after": 8,
        "lapse": "deny"
      },
      "review": null,
      "scope": {
        "operations": [
          "edit_threshold"
        ],
        "resources": [
          {
            "keys": null,
            "type": "Threshold"
          }
        ]
      }
    },
    {
      "competent": [
        "office-top"
      ],
      "concurrence": false,
      "id": "m-emerg",
      "on_absent": "await",
      "review": null,
      "scope": {
        "operations": [
          "emergency:declare"
        ],
        "resources": []
      }
    }
  ],
  "model": "hierarchical",
  "precedence": [
    "specialis",
    "superior"
  ],
  "spec": "r3-governance-1",
  "superior": [
    [
      "office-lead",
      "office-mid"
    ],
    [
      "office-mid",
      "office-top"
    ]
  ]
}
